{
  "$schema": "https://json-schema.org/draft/2020-12/schema",
  "type": "object",
  "required": [
    "schemaVersion",
    "spike",
    "sourceCommit",
    "command",
    "environment",
    "inputs",
    "measurements",
    "assertions",
    "status"
  ],
  "additionalProperties": false,
  "properties": {
    "schemaVersion": {
      "const": "1"
    },
    "spike": {
      "type": "string"
    },
    "sourceCommit": {
      "type": "string"
    },
    "command": {
      "type": "string"
    },
    "environment": {
      "type": "object"
    },
    "inputs": {
      "type": "object"
    },
    "measurements": {
      "type": "object"
    },
    "assertions": {
      "type": "array",
      "minItems": 1,
      "items": {
        "type": "object",
        "required": [
          "name",
          "passed"
        ],
        "additionalProperties": false,
        "properties": {
          "name": {
            "type": "string"
          },
          "passed": {
            "type": "boolean"
          }
        }
      }
    },
    "status": {
      "enum": [
        "pass",
        "fail"
      ]
    }
  }
}

